{
  "schema_version": 1,
  "game_version": "Beta 1.8.42",
  "currency": "EXACT_TARGET",
  "complete": true,
  "source_probe_zip_sha256": "0057763b41f7433229b137cf73138fef8f8cd3a5a82512b6b757108e72a50746",
  "source_sanitized_bundle_sha256": "dc35c7d07bce42d1ee9168bd3797fae7e4615cc980ca0f386b6faa75f4e63571",
  "normalization": {
    "representation": "OBJECT_IDENTIFIERS",
    "derived_from": "resolved-vanilla-data-manifest.json",
    "identifier_set_preserved": true
  },
  "namespaces": {
    "software_type": {
      "identifier_count": 12,
      "identifiers": [
        {
          "identifier": "2D Editor",
          "occurrences": [
            {
              "evidence_ref": "resolved-vanilla-data-manifest.json#identifier_namespaces/software_type"
            }
          ]
        },
        {
          "identifier": "3D Editor",
          "occurrences": [
            {
              "evidence_ref": "resolved-vanilla-data-manifest.json#identifier_namespaces/software_type"
            }
          ]
        },
        {
          "identifier": "Antivirus",
          "occurrences": [
            {
              "evidence_ref": "resolved-vanilla-data-manifest.json#identifier_namespaces/software_type"
            }
          ]
        },
        {
          "identifier": "Audio Tool",
          "occurrences": [
            {
              "evidence_ref": "resolved-vanilla-data-manifest.json#identifier_namespaces/software_type"
            }
          ]
        },
        {
          "identifier": "Distribution platform",
          "occurrences": [
            {
              "evidence_ref": "resolved-vanilla-data-manifest.json#identifier_namespaces/software_type"
            }
          ]
        },
        {
          "identifier": "Embedded System",
          "occurrences": [
            {
              "evidence_ref": "resolved-vanilla-data-manifest.json#identifier_namespaces/software_type"
            }
          ]
        },
        {
          "identifier": "Game",
          "occurrences": [
            {
              "evidence_ref": "resolved-vanilla-data-manifest.json#identifier_namespaces/software_type"
            }
          ]
        },
        {
          "identifier": "Game Assets",
          "occurrences": [
            {
              "evidence_ref": "resolved-vanilla-data-manifest.json#identifier_namespaces/software_type"
            }
          ]
        },
        {
          "identifier": "Logistics Application",
          "occurrences": [
            {
              "evidence_ref": "resolved-vanilla-data-manifest.json#identifier_namespaces/software_type"
            }
          ]
        },
        {
          "identifier": "Office Software",
          "occurrences": [
            {
              "evidence_ref": "resolved-vanilla-data-manifest.json#identifier_namespaces/software_type"
            }
          ]
        },
        {
          "identifier": "Operating System",
          "occurrences": [
            {
              "evidence_ref": "resolved-vanilla-data-manifest.json#identifier_namespaces/software_type"
            }
          ]
        },
        {
          "identifier": "Website",
          "occurrences": [
            {
              "evidence_ref": "resolved-vanilla-data-manifest.json#identifier_namespaces/software_type"
            }
          ]
        }
      ]
    },
    "company_type": {
      "identifier_count": 7,
      "identifiers": [
        {
          "identifier": "Antivirus",
          "occurrences": [
            {
              "evidence_ref": "resolved-vanilla-data-manifest.json#identifier_namespaces/company_type"
            }
          ]
        },
        {
          "identifier": "ComputerOS",
          "occurrences": [
            {
              "evidence_ref": "resolved-vanilla-data-manifest.json#identifier_namespaces/company_type"
            }
          ]
        },
        {
          "identifier": "ConsoleOS",
          "occurrences": [
            {
              "evidence_ref": "resolved-vanilla-data-manifest.json#identifier_namespaces/company_type"
            }
          ]
        },
        {
          "identifier": "CreativeTools",
          "occurrences": [
            {
              "evidence_ref": "resolved-vanilla-data-manifest.json#identifier_namespaces/company_type"
            }
          ]
        },
        {
          "identifier": "Games",
          "occurrences": [
            {
              "evidence_ref": "resolved-vanilla-data-manifest.json#identifier_namespaces/company_type"
            }
          ]
        },
        {
          "identifier": "Office",
          "occurrences": [
            {
              "evidence_ref": "resolved-vanilla-data-manifest.json#identifier_namespaces/company_type"
            }
          ]
        },
        {
          "identifier": "PhoneOS",
          "occurrences": [
            {
              "evidence_ref": "resolved-vanilla-data-manifest.json#identifier_namespaces/company_type"
            }
          ]
        }
      ]
    },
    "name_generator": {
      "identifier_count": 26,
      "identifiers": [
        {
          "identifier": "2DEditor",
          "occurrences": [
            {
              "evidence_ref": "resolved-vanilla-data-manifest.json#identifier_namespaces/name_generator"
            }
          ]
        },
        {
          "identifier": "3DEditor",
          "occurrences": [
            {
              "evidence_ref": "resolved-vanilla-data-manifest.json#identifier_namespaces/name_generator"
            }
          ]
        },
        {
          "identifier": "Antivirus",
          "occurrences": [
            {
              "evidence_ref": "resolved-vanilla-data-manifest.json#identifier_namespaces/name_generator"
            }
          ]
        },
        {
          "identifier": "Audio",
          "occurrences": [
            {
              "evidence_ref": "resolved-vanilla-data-manifest.json#identifier_namespaces/name_generator"
            }
          ]
        },
        {
          "identifier": "Company",
          "occurrences": [
            {
              "evidence_ref": "resolved-vanilla-data-manifest.json#identifier_namespaces/name_generator"
            }
          ]
        },
        {
          "identifier": "Console",
          "occurrences": [
            {
              "evidence_ref": "resolved-vanilla-data-manifest.json#identifier_namespaces/name_generator"
            }
          ]
        },
        {
          "identifier": "ContentPack",
          "occurrences": [
            {
              "evidence_ref": "resolved-vanilla-data-manifest.json#identifier_namespaces/name_generator"
            }
          ]
        },
        {
          "identifier": "ContractCompany",
          "occurrences": [
            {
              "evidence_ref": "resolved-vanilla-data-manifest.json#identifier_namespaces/name_generator"
            }
          ]
        },
        {
          "identifier": "Distribution",
          "occurrences": [
            {
              "evidence_ref": "resolved-vanilla-data-manifest.json#identifier_namespaces/name_generator"
            }
          ]
        },
        {
          "identifier": "Financial",
          "occurrences": [
            {
              "evidence_ref": "resolved-vanilla-data-manifest.json#identifier_namespaces/name_generator"
            }
          ]
        },
        {
          "identifier": "Framework",
          "occurrences": [
            {
              "evidence_ref": "resolved-vanilla-data-manifest.json#identifier_namespaces/name_generator"
            }
          ]
        },
        {
          "identifier": "GameAdventure",
          "occurrences": [
            {
              "evidence_ref": "resolved-vanilla-data-manifest.json#identifier_namespaces/name_generator"
            }
          ]
        },
        {
          "identifier": "GameExpansion",
          "occurrences": [
            {
              "evidence_ref": "resolved-vanilla-data-manifest.json#identifier_namespaces/name_generator"
            }
          ]
        },
        {
          "identifier": "GameFPS",
          "occurrences": [
            {
              "evidence_ref": "resolved-vanilla-data-manifest.json#identifier_namespaces/name_generator"
            }
          ]
        },
        {
          "identifier": "GameRPG",
          "occurrences": [
            {
              "evidence_ref": "resolved-vanilla-data-manifest.json#identifier_namespaces/name_generator"
            }
          ]
        },
        {
          "identifier": "GameRTS",
          "occurrences": [
            {
              "evidence_ref": "resolved-vanilla-data-manifest.json#identifier_namespaces/name_generator"
            }
          ]
        },
        {
          "identifier": "GameSimulation",
          "occurrences": [
            {
              "evidence_ref": "resolved-vanilla-data-manifest.json#identifier_namespaces/name_generator"
            }
          ]
        },
        {
          "identifier": "GameSport",
          "occurrences": [
            {
              "evidence_ref": "resolved-vanilla-data-manifest.json#identifier_namespaces/name_generator"
            }
          ]
        },
        {
          "identifier": "Joystick",
          "occurrences": [
            {
              "evidence_ref": "resolved-vanilla-data-manifest.json#identifier_namespaces/name_generator"
            }
          ]
        },
        {
          "identifier": "None",
          "occurrences": [
            {
              "evidence_ref": "resolved-vanilla-data-manifest.json#identifier_namespaces/name_generator"
            }
          ]
        },
        {
          "identifier": "Office",
          "occurrences": [
            {
              "evidence_ref": "resolved-vanilla-data-manifest.json#identifier_namespaces/name_generator"
            }
          ]
        },
        {
          "identifier": "OS",